{
  "$schema": "http://json-schema.org/draft-07/schema#",
  "title": "dev-pipeline configuration",
  "description": "Configuration file for the Claude Code dev-pipeline plugin. Place as pipeline.config.json in your repo root or .claude/ directory.",
  "type": "object",
  "properties": {
    "$schema": {
      "type": "string",
      "description": "JSON Schema reference for IDE autocompletion"
    },
    "specialists": {
      "type": "object",
      "description": "Configure which specialist skills are available and when they trigger",
      "properties": {
        "defaults": {
          "type": "array",
          "items": {
            "type": "string",
            "enum": ["code-reviewer", "frontend-dev", "backend-dev", "qa-engineer", "ux-designer"]
          },
          "default": ["code-reviewer"],
          "description": "Specialists that always run on review commands"
        },
        "filePatterns": {
          "type": "object",
          "additionalProperties": {
            "type": "string",
            "enum": ["code-reviewer", "frontend-dev", "backend-dev", "qa-engineer", "ux-designer"]
          },
          "default": {},
          "description": "Map glob patterns to specialists. Used by 'review all' to dispatch the right specialist per file."
        }
      },
      "additionalProperties": false
    },
    "issues": {
      "type": "object",
      "description": "Configure issue discovery and branch creation",
      "properties": {
        "label": {
          "type": "string",
          "default": "claude",
          "description": "GitHub label used to find issues for automation"
        },
        "branchPrefix": {
          "type": "string",
          "default": "fix",
          "description": "Prefix for branches created by solve-issue (e.g. fix/42-description)"
        },
        "autoAssign": {
          "type": "boolean",
          "default": true,
          "description": "Automatically assign the issue to the current user when solving"
        }
      },
      "additionalProperties": false
    },
    "batch": {
      "type": "object",
      "description": "Configure batch issue processing",
      "properties": {
        "maxParallel": {
          "type": "integer",
          "minimum": 1,
          "maximum": 10,
          "default": 3,
          "description": "Maximum number of parallel agents for batch-issues"
        }
      },
      "additionalProperties": false
    },
    "quality": {
      "type": "object",
      "description": "Configure which quality gates are enforced",
      "properties": {
        "requireTests": {
          "type": "boolean",
          "default": true,
          "description": "Run test suite before allowing stop"
        },
        "requireBuild": {
          "type": "boolean",
          "default": true,
          "description": "Run build before marking task complete"
        },
        "requireLint": {
          "type": "boolean",
          "default": true,
          "description": "Run linter after file edits"
        }
      },
      "additionalProperties": false
    },
    "review": {
      "type": "object",
      "description": "Configure code review behavior",
      "properties": {
        "securityCheck": {
          "type": "boolean",
          "default": true,
          "description": "Include security checklist in reviews"
        },
        "performanceCheck": {
          "type": "boolean",
          "default": true,
          "description": "Include performance checklist in reviews"
        },
        "maxFileReviewSize": {
          "type": "integer",
          "minimum": 50,
          "maximum": 5000,
          "default": 500,
          "description": "Maximum lines per file to review (larger files get a warning)"
        }
      },
      "additionalProperties": false
    }
  },
  "additionalProperties": false
}
